<EntityTreeRoot xmlns:xsi="http://www.w3.org/2001/XMLSchema-instance" xsi:noNamespaceSchemaLocation="EntityTree.xsd">
  <Title>Строения</Title>
  <EntityTypeName>Building</EntityTypeName>
  <IconClass>et-b</IconClass>
  <Visible>false</Visible>
  <Script>
    <Id>4</Id>
  </Script>
  <EntityTreeInverseProperties>    
    <EntityTreeInverseProperty>UserLinksChannel.User</EntityTreeInverseProperty>
    <EntityTreeInverseProperty>AccessPoint.AccessPointLinksBuilding.Building.Placements.PlacementPurpose</EntityTreeInverseProperty>
      <EntityTreeInverseProperty>AccessPoint.AccessPointLinksBuilding.Building.Placements.Channels</EntityTreeInverseProperty>
    <EntityTreeInverseProperty>AccessPoint.AccessPointLinksBuilding.Building.Placements.UserAdditionalInfo</EntityTreeInverseProperty>
    <EntityTreeInverseProperty>AccessPoint.AccessPointLinksBuilding.Building.ResourceSystems</EntityTreeInverseProperty>
  </EntityTreeInverseProperties>
  <EntityTreeNodes>
    <EntityTreeNode>
      <EntityTypeName>AccessPointLinkBuilding</EntityTypeName>
      <Property>AccessPointLinksBuilding</Property>      
      <Visible>false</Visible>
      <EntityTreeNodes>
        <EntityTreeNode>
          <EntityTypeName>AccessPoint</EntityTypeName>
          <Property>AccessPoint</Property>
          <IconClass>et-ap</IconClass>          
          <Visible>true</Visible>
          <EntityTreeNodes>
            <EntityTreeNode>
              <EntityTypeName>MeasurementDevice</EntityTypeName>
              <Property>MeasurementDevices</Property>                            
              <IconClass>et-md</IconClass>
              <Visible>true</Visible>
            </EntityTreeNode>            
          </EntityTreeNodes>
        </EntityTreeNode>
      </EntityTreeNodes>
    </EntityTreeNode>
    <EntityTreeNode >
      <EntityTypeName>Placement</EntityTypeName>
      <Property>Placements</Property>
      <CustomPropertyChain>Placements.PlacementPurpose</CustomPropertyChain>
      <IconClass>et-pl</IconClass>
      <Visible>true</Visible>
      <EntityTreeNodes>
        <EntityTreeNode>
          <EntityTypeName>Channel</EntityTypeName>
          <Property>Channels</Property>                    
          <Visible>false</Visible>
          <EntityTreeNodes>
            <EntityTreeNode>
              <EntityTypeName>MeasurementDevice</EntityTypeName>
              <Property>MeasurementDevice</Property>                           
              <IconClass>et-md</IconClass>
              <Visible>true</Visible>
            </EntityTreeNode>
          </EntityTreeNodes>
        </EntityTreeNode>
        <EntityTreeNode>
          <EntityTypeName>UserAdditionalInfo</EntityTypeName>
          <Property>UserAdditionalInfo</Property>          
          <IconClass>et-uai</IconClass>
          <Visible>true</Visible>
          <EntityTreeNodes>
            <EntityTreeNode>
              <EntityTypeName>User</EntityTypeName>
              <Property>User</Property>              
              <IconClass>et-us</IconClass>
              <Visible>true</Visible>
            </EntityTreeNode>
          </EntityTreeNodes>
        </EntityTreeNode>
      </EntityTreeNodes>
    </EntityTreeNode>    
  </EntityTreeNodes>
</EntityTreeRoot>